Country Code,Country Name,Series Code,Series Name,1990,1991,1992,1993,1994,1995,1996,1997,1998,1999,2000,2001,2002,2003,2004,2005,2006,2007,2008,2009,2010,2011
KSV,Kosovo,AG.LND.FRST.K2,Forest area (sq. km),,,,,,,,,,,,,,,,,,,,,,
KSV,Kosovo,AG.LND.FRST.ZS,Forest area (% of land area),,,,,,,,,,,,,,,,,,,,,,
KSV,Kosovo,DC.ODA.COMM.CD,Total bilateral ODA commitments (current US$),,,,,,,,,,,,,,,,,,,,,,
KSV,Kosovo,DC.ODA.COMM.SA.CD,Total bilateral sector allocable ODA commitments (current US$),,,,,,,,,,,,,,,,,,,,,,
KSV,Kosovo,DC.ODA.SOCL.CD,"Bilateral, sector-allocable ODA to basic social services (current US$)",,,,,,,,,,,,,,,,,,,,,,
KSV,Kosovo,DC.ODA.SOCL.ZS,"Bilateral, sector-allocable ODA to basic social services (% of bilateral ODA commitments)",,,,,,,,,,,,,,,,,,,,,,
KSV,Kosovo,DC.ODA.TLDC.CD,"Net ODA provided, to the least developed countries (current US$)",,,,,,,,,,,,,,,,,,,,,,
KSV,Kosovo,DC.ODA.TLDC.GN.ZS,Net ODA provided to the least developed countries (% of GNI),,,,,,,,,,,,,,,,,,,,,,
KSV,Kosovo,DC.ODA.TOTL.CD,"Net ODA provided, total (current US$)",,,,,,,,,,,,,,,,,,,,,,
KSV,Kosovo,DC.ODA.TOTL.GN.ZS,"Net ODA provided, total (% of GNI)",,,,,,,,,,,,,,,,,,,,,,
KSV,Kosovo,DC.ODA.TOTL.KD,"Net ODA provided, total (constant 2009 US$)",,,,,,,,,,,,,,,,,,,,,,
KSV,Kosovo,DC.ODA.UNTD.CD,Bilateral ODA commitments that is untied (current US$),,,,,,,,,,,,,,,,,,,,,,
KSV,Kosovo,DC.ODA.UNTD.ZS,Bilateral ODA commitments that is untied (% of bilateral ODA commitments),,,,,,,,,,,,,,,,,,,,,,
KSV,Kosovo,DT.HPC.COMR.PV,"Debt relief committed under HIPC initiative, cumulative US$ in end-2009 NPV terms",,,,,,,,,,,,,,,,,,,,,,
KSV,Kosovo,DT.HPC.MDRI.PV,"Debt relief delivered in full under MDRI initiative, cumulative US$ in end-2009 NPV terms",,,,,,,,,,,,,,,,,,,,,,
KSV,Kosovo,DT.HPC.STTS,Status under enhanced HIPC initiative,,,,,,,,,,,,,,,,,,,,,,
KSV,Kosovo,DT.HPC.TOTL.PV,"Debt relief committed under HIPC and MDRI initiatives, cumulative US$ in end-2009 NPV terms",,,,,,,,,,,,,,,,,,,,,,
KSV,Kosovo,DT.ODA.ALLD.CD,Net official development assistance and official aid received (current US$),,,,,,,,,,,9.50000000000000E+05,1.44000000000000E+06,,,,,,,,7.87970000000000E+08,,
KSV,Kosovo,DT.ODA.ODAT.CD,Net official development assistance received (current US$),,,,,,,,,,,9.50000000000000E+05,1.44000000000000E+06,,,,,,,,7.87970000000000E+08,,
KSV,Kosovo,DT.ODA.ODAT.GN.ZS,Net ODA received (% of GNI),,,,,,,,,,,,,,,,,,,,1.41547493386573E+01,,
KSV,Kosovo,DT.ODA.ODAT.PC.ZS,Net ODA received per capita (current US$),,,,,,,,,,,5.58823529411765E-01,8.36722835560720E-01,,,,,,,,4.36548476454294E+02,,
KSV,Kosovo,DT.TDS.DECT.EX.ZS,"Total debt service (% of exports of goods, services and income)",,,,,,,,,,,,,,,,,,,,2.08385139818691E+01,,
KSV,Kosovo,DT.TDS.DPPF.XP.ZS,"Debt service (PPG and IMF only, % of exports, excluding workers' remittances)",,,,,,,,,,,,,,,,,,,,,,
KSV,Kosovo,EG.GDP.PUSE.KO.PP.KD,GDP per unit of energy use (constant 2005 PPP $ per kg of oil equivalent),,,,,,,,,,,,,,,,,,,,,,
KSV,Kosovo,EG.USE.COMM.GD.PP.KD,"Energy use (kg of oil equivalent) per $1,000 GDP (constant 2005 PPP)",,,,,,,,,,,,,,,,,,,,,,
KSV,Kosovo,EN.ATM.CO2E.KT,CO2 emissions (kt),,,,,,,,,,,,,,,,,,,,,,
KSV,Kosovo,EN.ATM.CO2E.PC,CO2 emissions (metric tons per capita),,,,,,,,,,,,,,,,,,,,,,
KSV,Kosovo,EN.ATM.CO2E.PP.GD,CO2 emissions (kg per PPP $ of GDP),,,,,,,,,,,,,,,,,,,,,,
KSV,Kosovo,EN.POP.SLUM.UR.ZS,Population living in slums (% of urban population),,,,,,,,,,,,,,,,,,,,,,
KSV,Kosovo,ER.H2O.FWTL.ZS,"Annual freshwater withdrawals, total (% of internal resources)",,,,,,,,,,,,,,,,,,,,,,
KSV,Kosovo,ER.H2O.INTR.PC,Renewable internal freshwater resources per capita (cubic meters),,,,,,,,,,,,,,,,,,,,,,
KSV,Kosovo,ER.LND.PTLD.TR.ZS,Terrestrial protected areas (% of total surface area),,,,,,,,,,,,,,,,,,,,,,
KSV,Kosovo,ER.MRN.PTMR.ZS,Marine protected areas (% of total surface area),,,,,,,,,,,,,,,,,,,,,,
KSV,Kosovo,IT.CEL.SETS.P2,Mobile cellular subscriptions (per 100 people),,,,,,,,,,,,,,,,,,,,,,
KSV,Kosovo,IT.MLT.MAIN.P2,Telephone lines (per 100 people),,,,,,,,,,,,,,,,,,,,,,
KSV,Kosovo,IT.NET.USER.P2,Internet users (per 100 people),,,,,,,,,,,,,,,,,,,,,,
KSV,Kosovo,NE.GDI.TOTL.ZS,Gross capital formation (% of GDP),,,,,,,,,,,,,,,,,2.55968296328458E+01,2.61681326143013E+01,2.86322591592138E+01,2.74175966044693E+01,3.02422007912119E+01,
KSV,Kosovo,NE.TRD.GNFS.ZS,Trade (% of GDP),,,,,,,,,,,,,,,,,6.48430234422602E+01,6.87451823797383E+01,7.12970551253644E+01,6.76797747188139E+01,7.13468301824212E+01,
KSV,Kosovo,NY.AGR.SUBS.GD.ZS,Agricultural support estimate (% of GDP),,,,,,,,,,,,,,,,,,,,,,
KSV,Kosovo,NY.GNP.ATLS.CD,"GNI, Atlas method (current US$)",,,,,,,,,,,,,,,,,4.36707791646756E+09,4.77092019148562E+09,5.39012442422518E+09,5.74417606486781E+09,5.98110169496943E+09,
KSV,Kosovo,NY.GNP.PCAP.CD,"GNI per capita, Atlas method (current US$)",,,,,,,,,,,,,,,,,2.46000000000000E+03,2.67000000000000E+03,3.00000000000000E+03,3.18000000000000E+03,3.30000000000000E+03,
KSV,Kosovo,PA.NUS.PPP,"PPP conversion factor, GDP (LCU per international $)",,,,,,,,,,,,,,,,,,,,,,
KSV,Kosovo,PA.NUS.PRVT.PP,"PPP conversion factor, private consumption (LCU per international $)",,,,,,,,,,,,,,,,,,,,,,
KSV,Kosovo,SE.ADT.1524.LT.FE.ZS,"Literacy rate, youth female (% of females ages 15-24)",,,,,,,,,,,,,,,,,,,,,,
KSV,Kosovo,SE.ADT.1524.LT.MA.ZS,"Literacy rate, youth male (% of males ages 15-24)",,,,,,,,,,,,,,,,,,,,,,
KSV,Kosovo,SE.ADT.1524.LT.ZS,"Literacy rate, youth total (% of people ages 15-24)",,,,,,,,,,,,,,,,,,,,,,
KSV,Kosovo,SE.ADT.LITR.ZS,"Literacy rate, adult total (% of people ages 15 and above)",,,,,,,,,,,,,,,,,,,,,,
KSV,Kosovo,SE.ENR.ORPH,Ratio of school attendance of orphans to school attendance of non-orphans ages 10-14,,,,,,,,,,,,,,,,,,,,,,
KSV,Kosovo,SE.ENR.PRIM.FM.ZS,Ratio of female to male primary enrollment (%),,,,,,,,,,,,,,,,,,,,,,
KSV,Kosovo,SE.ENR.PRSC.FM.ZS,Ratio of girls to boys in primary and secondary education (%),,,,,,,,,,,,,,,,,,,,,,
KSV,Kosovo,SE.ENR.SECO.FM.ZS,Ratio of female to male secondary enrollment (%),,,,,,,,,,,,,,,,,,,,,,
KSV,Kosovo,SE.ENR.TERT.FM.ZS,Ratio of female to male tertiary enrollment (%),,,,,,,,,,,,,,,,,,,,,,
KSV,Kosovo,SE.PRM.CMPT.ZS,"Primary completion rate, total (% of relevant age group)",,,,,,,,,,,,,,,,,,,,,,
KSV,Kosovo,SE.PRM.NENR,"School enrollment, primary (% net)",,,,,,,,,,,,,,,,,,,,,,
KSV,Kosovo,SE.PRM.PRSL.FE.ZS,"Persistence to last grade of primary, female (% of cohort)",,,,,,,,,,,,,,,,,,,,,,
KSV,Kosovo,SE.PRM.PRSL.MA.ZS,"Persistence to last grade of primary, male (% of cohort)",,,,,,,,,,,,,,,,,,,,,,
KSV,Kosovo,SE.PRM.PRSL.ZS,"Persistence to last grade of primary, total (% of cohort)",,,,,,,,,,,,,,,,,,,,,,
KSV,Kosovo,SE.PRM.TENR,"Total enrollment, primary (% net)",,,,,,,,,,,,,,,,,,,,,,
KSV,Kosovo,SG.GEN.PARL.ZS,Proportion of seats held by women in national parliaments (%),,,,,,,,,,,,,,,,,,,,,,
KSV,Kosovo,SH.CON.1524.FE.ZS,"Condom use, population ages 15-24, female (% of females ages 15-24)",,,,,,,,,,,,,,,,,,,,,,
KSV,Kosovo,SH.CON.1524.MA.ZS,"Condom use, population ages 15-24, male (% of males ages 15-24)",,,,,,,,,,,,,,,,,,,,,,
KSV,Kosovo,SH.CON.AIDS.FE.ZS,"Condom use with non regular partner, % adults(15-49), female",,,,,,,,,,,,,,,,,,,,,,
KSV,Kosovo,SH.CON.AIDS.MA.ZS,"Condom use with non regular partner, % adults(15-49), male",,,,,,,,,,,,,,,,,,,,,,
KSV,Kosovo,SH.DYN.AIDS.DH,AIDS estimated deaths (UNAIDS estimates),,,,,,,,,,,,,,,,,,,,,,
KSV,Kosovo,SH.DYN.AIDS.ZS,"Prevalence of HIV, total (% of population ages 15-49)",,,,,,,,,,,,,,,,,,,,,,
KSV,Kosovo,SH.DYN.MORT,"Mortality rate, under-5 (per 1,000)",,,,,,,,,,,,,,,,,,,,,,
KSV,Kosovo,SH.H2O.SAFE.ZS,Improved water source (% of population with access),,,,,,,,,,,,,,,,,,,,,,
KSV,Kosovo,SH.HIV.1524.FE.ZS,"Prevalence of HIV, female (% ages 15-24)",,,,,,,,,,,,,,,,,,,,,,
KSV,Kosovo,SH.HIV.1524.KW.FE.ZS,"Comprehensive correct knowledge of HIV/AIDS, ages 15-24, female (2 prevent ways and reject 3 misconceptions)",,,,,,,,,,,,,,,,,,,,,,
KSV,Kosovo,SH.HIV.1524.KW.MA.ZS,"Comprehensive correct knowledge of HIV/AIDS, ages 15-24, male (2 prevent ways and reject 3 misconceptions)",,,,,,,,,,,,,,,,,,,,,,
KSV,Kosovo,SH.HIV.1524.MA.ZS,"Prevalence of HIV, male (% ages 15-24)",,,,,,,,,,,,,,,,,,,,,,
KSV,Kosovo,SH.HIV.ARTC.ZS,Antiretroviral therapy coverage (% of people with advanced HIV infection),,,,,,,,,,,,,,,,,,,,,,
KSV,Kosovo,SH.HIV.KNOW.FE.ZS,Percentage of females ages 15-49 having comprehensive correct knowledge about HIV (2 prevent ways and reject 3 misconceptions) (%),,,,,,,,,,,,,,,,,,,,,,
KSV,Kosovo,SH.HIV.KNOW.MA.ZS,Percentage of males ages 15-49 having comprehensive correct knowledge about HIV (2 prevent ways and reject 3 misconceptions) (%),,,,,,,,,,,,,,,,,,,,,,
KSV,Kosovo,SH.HIV.ORPH,Children orphaned by HIV/AIDS,,,,,,,,,,,,,,,,,,,,,,
KSV,Kosovo,SH.IMM.MEAS,"Immunization, measles (% of children ages 12-23 months)",,,,,,,,,,,,,,,,,,,,,,
KSV,Kosovo,SH.MLR.NETS.ZS,Use of insecticide-treated bed nets (% of under-5 population),,,,,,,,,,,,,,,,,,,,,,
KSV,Kosovo,SH.MLR.TRET.ZS,Children with fever receiving antimalarial drugs (% of children under age 5 with fever),,,,,,,,,,,,,,,,,,,,,,
KSV,Kosovo,SH.STA.ACSN,Improved sanitation facilities (% of population with access),,,,,,,,,,,,,,,,,,,,,,
KSV,Kosovo,SH.STA.ANV4.ZS,Pregnant women receiving prenatal care of at least four visits (% of pregnant women),,,,,,,,,,,,,,,,,,,,,,
KSV,Kosovo,SH.STA.ANVC.ZS,Pregnant women receiving prenatal care (%),,,,,,,,,,,,,,,,,,,,,,
KSV,Kosovo,SH.STA.ARIC.ZS,ARI treatment (% of children under 5 taken to a health provider),,,,,,,,,,,,,,,,,,,,,,
KSV,Kosovo,SH.STA.BRTC.ZS,Births attended by skilled health staff (% of total),,,,,,,,,,,,,,,,,,,,,,
KSV,Kosovo,SH.STA.MALN.ZS,"Malnutrition prevalence, weight for age (% of children under 5)",,,,,,,,,,,,,,,,,,,,,,
KSV,Kosovo,SH.STA.MALR,Malaria cases reported,,,,,,,,,,,,,,,,,,,,,,
KSV,Kosovo,SH.STA.MMRT,"Maternal mortality ratio (modeled estimate, per 100,000 live births)",,,,,,,,,,,,,,,,,,,,,,
KSV,Kosovo,SH.TBS.CURE.ZS,Tuberculosis treatment success rate (% of registered cases),,,,,,,,,,,,,,,,,,,,,,
KSV,Kosovo,SH.TBS.DTEC.ZS,"Tuberculosis case detection rate (%, all forms)",,,,,,,,,,,,,,,,,,,,,,
KSV,Kosovo,SH.TBS.INCD,"Incidence of tuberculosis (per 100,000 people)",,,,,,,,,,,,,,,,,,,,,,
KSV,Kosovo,SH.TBS.MORT,"Tuberculosis death rate (per 100,000 people)",,,,,,,,,,,,,,,,,,,,,,
KSV,Kosovo,SI.DST.FRST.20,Income share held by lowest 20%,,,,,,,,,,,,,,,,,,,,,,
KSV,Kosovo,SI.POV.2DAY,Poverty headcount ratio at $2 a day (PPP) (% of population),,,,,,,,,,,,,,,,,,,,,,
KSV,Kosovo,SI.POV.DDAY,Poverty headcount ratio at $1.25 a day (PPP) (% of population),,,,,,,,,,,,,,,,,,,,,,
KSV,Kosovo,SI.POV.GAP2,Poverty gap at $2 a day (PPP) (%),,,,,,,,,,,,,,,,,,,,,,
KSV,Kosovo,SI.POV.GAPS,Poverty gap at $1.25 a day (PPP) (%),,,,,,,,,,,,,,,,,,,,,,
KSV,Kosovo,SI.POV.NAGP,Poverty gap at national poverty line (%),,,,,,,,,,,,,,,1.19000000000000E+01,,1.33000000000000E+01,,,,,
KSV,Kosovo,SI.POV.NAHC,Poverty headcount ratio at national poverty line (% of population),,,,,,,,,,,,,,3.77000000000000E+01,4.37000000000000E+01,3.48000000000000E+01,4.50000000000000E+01,,,,,
KSV,Kosovo,SI.POV.RUGP,Poverty gap at rural poverty line (%),,,,,,,,,,,,,,,,,1.43000000000000E+01,,,,,
KSV,Kosovo,SI.POV.RUHC,Poverty headcount ratio at rural poverty line (% of rural population),,,,,,,,,,,,,,3.44000000000000E+01,4.42000000000000E+01,3.72000000000000E+01,4.92000000000000E+01,,,,,
KSV,Kosovo,SI.POV.URGP,Poverty gap at urban poverty line (%),,,,,,,,,,,,,,,,,1.13000000000000E+01,,,,,
KSV,Kosovo,SI.POV.URHC,Poverty headcount ratio at urban poverty line (% of urban population),,,,,,,,,,,,,,4.66000000000000E+01,4.21000000000000E+01,3.03000000000000E+01,3.74000000000000E+01,,,,,
KSV,Kosovo,SL.EMP.1524.SP.FE.ZS,"Employment to population ratio, ages 15-24, female (%)",,,,,,,,,,,,,,,,,,,,,,
KSV,Kosovo,SL.EMP.1524.SP.MA.ZS,"Employment to population ratio, ages 15-24, male (%)",,,,,,,,,,,,,,,,,,,,,,
KSV,Kosovo,SL.EMP.1524.SP.ZS,"Employment to population ratio, ages 15-24, total (%)",,,,,,,,,,,,,,,,,,,,,,
KSV,Kosovo,SL.EMP.INSV.FE.ZS,Share of women employed in the nonagricultural sector (% of total nonagricultural employment),,,,,,,,,,,,,,,,,,,,,,
KSV,Kosovo,SL.EMP.SELF.FE.ZS,"Self-employed, female (% of females employed)",,,,,,,,,,,,,,,,,,,,,,
KSV,Kosovo,SL.EMP.SELF.MA.ZS,"Self-employed, male (% of males employed)",,,,,,,,,,,,,,,,,,,,,,
KSV,Kosovo,SL.EMP.SELF.ZS,"Self-employed, total (% of total employed)",,,,,,,,,,,,,,,,,,,,,,
KSV,Kosovo,SL.EMP.TOTL.SP.FE.ZS,"Employment to population ratio, 15+, female (%)",,,,,,,,,,,,,,,,,,,,,,
KSV,Kosovo,SL.EMP.TOTL.SP.MA.ZS,"Employment to population ratio, 15+, male (%)",,,,,,,,,,,,,,,,,,,,,,
KSV,Kosovo,SL.EMP.TOTL.SP.ZS,"Employment to population ratio, 15+, total (%)",,,,,,,,,,,,,,,,,,,,,,
KSV,Kosovo,SL.EMP.VULN.FE.ZS,"Vulnerable employment, female (% of female employment)",,,,,,,,,,,,,,,,,,,,,,
KSV,Kosovo,SL.EMP.VULN.MA.ZS,"Vulnerable employment, male (% of male employment)",,,,,,,,,,,,,,,,,,,,,,
KSV,Kosovo,SL.EMP.VULN.ZS,"Vulnerable employment, total (% of total employment)",,,,,,,,,,,,,,,,,,,,,,
KSV,Kosovo,SL.FAM.WORK.FE.ZS,"Contributing family workers, female (% of females employed)",,,,,,,,,,,,,,,,,,,,,,
KSV,Kosovo,SL.FAM.WORK.MA.ZS,"Contributing family workers, male (% of males employed)",,,,,,,,,,,,,,,,,,,,,,
KSV,Kosovo,SL.FAM.WORK.ZS,"Contributing family workers, total (% of total employed)",,,,,,,,,,,,,,,,,,,,,,
KSV,Kosovo,SL.GDP.PCAP.EM.KD,GDP per person employed (constant 1990 PPP $),,,,,,,,,,,,,,,,,,,,,,
KSV,Kosovo,SN.ITK.DEFC.ZS,Prevalence of undernourishment (% of population),,,,,,,,,,,,,,,,,,,,,,
KSV,Kosovo,SP.ADO.TFRT,"Adolescent fertility rate (births per 1,000 women ages 15-19)",,,,,,,,,,,,,,,,,,,,,,
KSV,Kosovo,SP.DYN.CONU.ZS,Contraceptive prevalence (% of women ages 15-49),,,,,,,,,,,,,,,,,,,,,,
KSV,Kosovo,SP.DYN.IMRT.IN,"Mortality rate, infant (per 1,000 live births)",,,,,,,,,,,,,,,,,,,,,,
KSV,Kosovo,SP.DYN.LE00.IN,"Life expectancy at birth, total (years)",6.77587804878049E+01,6.79290243902439E+01,6.80892682926829E+01,6.82495121951220E+01,6.84000000000000E+01,6.85451219512195E+01,6.86856097560976E+01,6.88209756097561E+01,6.89512195121951E+01,6.69512195121951E+01,6.79512195121951E+01,6.79475609756098E+01,6.79387804878049E+01,6.81895121951220E+01,6.84402439024390E+01,6.86909756097561E+01,6.89368292682927E+01,6.91824390243903E+01,6.94180487804878E+01,6.96487804878049E+01,,
KSV,Kosovo,SP.DYN.TFRT.IN,"Fertility rate, total (births per woman)",3.90280000000000E+00,3.58440000000000E+00,2.95810000000000E+00,2.83960000000000E+00,2.70640000000000E+00,2.70140000000000E+00,2.69810000000000E+00,2.45730000000000E+00,2.56770000000000E+00,2.87810000000000E+00,2.95430000000000E+00,2.79900000000000E+00,2.66450000000000E+00,2.34300000000000E+00,2.53300000000000E+00,2.64730000000000E+00,2.42520000000000E+00,2.43100000000000E+00,2.38350000000000E+00,2.33680000000000E+00,,
KSV,Kosovo,SP.POP.TOTL,"Population, total",1.86200000000000E+06,1.89800000000000E+06,1.93200000000000E+06,1.96500000000000E+06,1.99700000000000E+06,2.02900000000000E+06,2.05900000000000E+06,2.08600000000000E+06,1.96600000000000E+06,1.76200000000000E+06,1.70000000000000E+06,1.72100000000000E+06,1.73700000000000E+06,1.74800000000000E+06,1.75700000000000E+06,1.76700000000000E+06,1.77700000000000E+06,1.78500000000000E+06,1.79500000000000E+06,1.80500000000000E+06,1.81500000000000E+06,
KSV,Kosovo,SP.UWT.TFRT,Unmet need for contraception (% of married women ages 15-49),,,,,,,,,,,,,,,,,,,,,,
KSV,Kosovo,TM.MRC.NOTX.DV.ZS,Goods (excluding arms) admitted free of tariffs from developing countries (% total merchandise imports excluding arms),,,,,,,,,,,,,,,,,,,,,,
KSV,Kosovo,TM.MRC.NOTX.LD.ZS,Goods (excluding arms) admitted free of tariffs from least developed countries (% total merchandise imports excluding arms),,,,,,,,,,,,,,,,,,,,,,
KSV,Kosovo,TM.TAX.AGRI.CD.DV,Average tariffs imposed by developed countries on agricultural products from developing countries (%),,,,,,,,,,,,,,,,,,,,,,
KSV,Kosovo,TM.TAX.AGRI.CD.LD,Average tariffs imposed by developed countries on agricultural products from least developed countries (%),,,,,,,,,,,,,,,,,,,,,,
KSV,Kosovo,TM.TAX.CLTH.CD.DV,Average tariffs imposed by developed countries on clothing products from developing countries (%),,,,,,,,,,,,,,,,,,,,,,
KSV,Kosovo,TM.TAX.CLTH.CD.LD,Average tariffs imposed by developed countries on clothing products from least developed countries (%),,,,,,,,,,,,,,,,,,,,,,
KSV,Kosovo,TM.TAX.TXTL.CD.DV,Average tariffs imposed by developed countries on textile products from developing countries (%),,,,,,,,,,,,,,,,,,,,,,
KSV,Kosovo,TM.TAX.TXTL.CD.LD,Average tariffs imposed by developed countries on textile products from least developed countries (%),,,,,,,,,,,,,,,,,,,,,,
