Country Code,Country Name,Series Code,Series Name,1990,1991,1992,1993,1994,1995,1996,1997,1998,1999,2000,2001,2002,2003,2004,2005,2006,2007,2008,2009,2010,2011
SSD,South Sudan,AG.LND.FRST.K2,Forest area (sq. km),,,,,,,,,,,,,,,,,,,,,,
SSD,South Sudan,AG.LND.FRST.ZS,Forest area (% of land area),,,,,,,,,,,,,,,,,,,,,,
SSD,South Sudan,DC.ODA.COMM.CD,Total bilateral ODA commitments (current US$),,,,,,,,,,,,,,,,,,,,,,
SSD,South Sudan,DC.ODA.COMM.SA.CD,Total bilateral sector allocable ODA commitments (current US$),,,,,,,,,,,,,,,,,,,,,,
SSD,South Sudan,DC.ODA.SOCL.CD,"Bilateral, sector-allocable ODA to basic social services (current US$)",,,,,,,,,,,,,,,,,,,,,,
SSD,South Sudan,DC.ODA.SOCL.ZS,"Bilateral, sector-allocable ODA to basic social services (% of bilateral ODA commitments)",,,,,,,,,,,,,,,,,,,,,,
SSD,South Sudan,DC.ODA.TLDC.CD,"Net ODA provided, to the least developed countries (current US$)",,,,,,,,,,,,,,,,,,,,,,
SSD,South Sudan,DC.ODA.TLDC.GN.ZS,Net ODA provided to the least developed countries (% of GNI),,,,,,,,,,,,,,,,,,,,,,
SSD,South Sudan,DC.ODA.TOTL.CD,"Net ODA provided, total (current US$)",,,,,,,,,,,,,,,,,,,,,,
SSD,South Sudan,DC.ODA.TOTL.GN.ZS,"Net ODA provided, total (% of GNI)",,,,,,,,,,,,,,,,,,,,,,
SSD,South Sudan,DC.ODA.TOTL.KD,"Net ODA provided, total (constant 2009 US$)",,,,,,,,,,,,,,,,,,,,,,
SSD,South Sudan,DC.ODA.UNTD.CD,Bilateral ODA commitments that is untied (current US$),,,,,,,,,,,,,,,,,,,,,,
SSD,South Sudan,DC.ODA.UNTD.ZS,Bilateral ODA commitments that is untied (% of bilateral ODA commitments),,,,,,,,,,,,,,,,,,,,,,
SSD,South Sudan,DT.HPC.COMR.PV,"Debt relief committed under HIPC initiative, cumulative US$ in end-2009 NPV terms",,,,,,,,,,,,,,,,,,,,,,
SSD,South Sudan,DT.HPC.MDRI.PV,"Debt relief delivered in full under MDRI initiative, cumulative US$ in end-2009 NPV terms",,,,,,,,,,,,,,,,,,,,,,
SSD,South Sudan,DT.HPC.STTS,Status under enhanced HIPC initiative,,,,,,,,,,,,,,,,,,,,,,
SSD,South Sudan,DT.HPC.TOTL.PV,"Debt relief committed under HIPC and MDRI initiatives, cumulative US$ in end-2009 NPV terms",,,,,,,,,,,,,,,,,,,,,,
SSD,South Sudan,DT.ODA.ALLD.CD,Net official development assistance and official aid received (current US$),,,,,,,,,,,,,,,,,,,,,,
SSD,South Sudan,DT.ODA.ODAT.CD,Net official development assistance received (current US$),,,,,,,,,,,,,,,,,,,,,,
SSD,South Sudan,DT.ODA.ODAT.GN.ZS,Net ODA received (% of GNI),,,,,,,,,,,,,,,,,,,,,,
SSD,South Sudan,DT.ODA.ODAT.PC.ZS,Net ODA received per capita (current US$),,,,,,,,,,,,,,,,,,,,,,
SSD,South Sudan,DT.TDS.DECT.EX.ZS,"Total debt service (% of exports of goods, services and income)",,,,,,,,,,,,,,,,,,,,,,
SSD,South Sudan,DT.TDS.DPPF.XP.ZS,"Debt service (PPG and IMF only, % of exports, excluding workers' remittances)",,,,,,,,,,,,,,,,,,,,,,
SSD,South Sudan,EG.GDP.PUSE.KO.PP.KD,GDP per unit of energy use (constant 2005 PPP $ per kg of oil equivalent),,,,,,,,,,,,,,,,,,,,,,
SSD,South Sudan,EG.USE.COMM.GD.PP.KD,"Energy use (kg of oil equivalent) per $1,000 GDP (constant 2005 PPP)",,,,,,,,,,,,,,,,,,,,,,
SSD,South Sudan,EN.ATM.CO2E.KT,CO2 emissions (kt),,,,,,,,,,,,,,,,,,,,,,
SSD,South Sudan,EN.ATM.CO2E.PC,CO2 emissions (metric tons per capita),,,,,,,,,,,,,,,,,,,,,,
SSD,South Sudan,EN.ATM.CO2E.PP.GD,CO2 emissions (kg per PPP $ of GDP),,,,,,,,,,,,,,,,,,,,,,
SSD,South Sudan,EN.POP.SLUM.UR.ZS,Population living in slums (% of urban population),,,,,,,,,,,,,,,,,,,,,,
SSD,South Sudan,ER.H2O.FWTL.ZS,"Annual freshwater withdrawals, total (% of internal resources)",,,,,,,,,,,,,,,,,,,,,,
SSD,South Sudan,ER.H2O.INTR.PC,Renewable internal freshwater resources per capita (cubic meters),,,,,,,,,,,,,,,,,,,,,,
SSD,South Sudan,ER.LND.PTLD.TR.ZS,Terrestrial protected areas (% of total surface area),,,,,,,,,,,,,,,,,,,,,,
SSD,South Sudan,ER.MRN.PTMR.ZS,Marine protected areas (% of total surface area),,,,,,,,,,,,,,,,,,,,,,
SSD,South Sudan,IT.CEL.SETS.P2,Mobile cellular subscriptions (per 100 people),,,,,,,,,,,,,,,,,,,,,,
SSD,South Sudan,IT.MLT.MAIN.P2,Telephone lines (per 100 people),,,,,,,,,,,,,,,,,,,,,,
SSD,South Sudan,IT.NET.USER.P2,Internet users (per 100 people),,,,,,,,,,,,,,,,,,,,,,
SSD,South Sudan,NE.GDI.TOTL.ZS,Gross capital formation (% of GDP),,,,,,,,,,,,,,,,,,,,,,
SSD,South Sudan,NE.TRD.GNFS.ZS,Trade (% of GDP),,,,,,,,,,,,,,,,,,,,,,
SSD,South Sudan,NY.AGR.SUBS.GD.ZS,Agricultural support estimate (% of GDP),,,,,,,,,,,,,,,,,,,,,,
SSD,South Sudan,NY.GNP.ATLS.CD,"GNI, Atlas method (current US$)",,,,,,,,,,,,,,,,,,,,,,
SSD,South Sudan,NY.GNP.PCAP.CD,"GNI per capita, Atlas method (current US$)",,,,,,,,,,,,,,,,,,,,,,
SSD,South Sudan,PA.NUS.PPP,"PPP conversion factor, GDP (LCU per international $)",,,,,,,,,,,,,,,,,,,,,,
SSD,South Sudan,PA.NUS.PRVT.PP,"PPP conversion factor, private consumption (LCU per international $)",,,,,,,,,,,,,,,,,,,,,,
SSD,South Sudan,SE.ADT.1524.LT.FE.ZS,"Literacy rate, youth female (% of females ages 15-24)",,,,,,,,,,,,,,,,,,,,,,
SSD,South Sudan,SE.ADT.1524.LT.MA.ZS,"Literacy rate, youth male (% of males ages 15-24)",,,,,,,,,,,,,,,,,,,,,,
SSD,South Sudan,SE.ADT.1524.LT.ZS,"Literacy rate, youth total (% of people ages 15-24)",,,,,,,,,,,,,,,,,,,,,,
SSD,South Sudan,SE.ADT.LITR.ZS,"Literacy rate, adult total (% of people ages 15 and above)",,,,,,,,,,,,,,,,,,,,,,
SSD,South Sudan,SE.ENR.ORPH,Ratio of school attendance of orphans to school attendance of non-orphans ages 10-14,,,,,,,,,,,,,,,,,,,,,,
SSD,South Sudan,SE.ENR.PRIM.FM.ZS,Ratio of female to male primary enrollment (%),,,,,,,,,,,,,,,,,,,,,,
SSD,South Sudan,SE.ENR.PRSC.FM.ZS,Ratio of girls to boys in primary and secondary education (%),,,,,,,,,,,,,,,,,,,,,,
SSD,South Sudan,SE.ENR.SECO.FM.ZS,Ratio of female to male secondary enrollment (%),,,,,,,,,,,,,,,,,,,,,,
SSD,South Sudan,SE.ENR.TERT.FM.ZS,Ratio of female to male tertiary enrollment (%),,,,,,,,,,,,,,,,,,,,,,
SSD,South Sudan,SE.PRM.CMPT.ZS,"Primary completion rate, total (% of relevant age group)",,,,,,,,,,,,,,,,,,,,,,
SSD,South Sudan,SE.PRM.NENR,"School enrollment, primary (% net)",,,,,,,,,,,,,,,,,,,,,,
SSD,South Sudan,SE.PRM.PRSL.FE.ZS,"Persistence to last grade of primary, female (% of cohort)",,,,,,,,,,,,,,,,,,,,,,
SSD,South Sudan,SE.PRM.PRSL.MA.ZS,"Persistence to last grade of primary, male (% of cohort)",,,,,,,,,,,,,,,,,,,,,,
SSD,South Sudan,SE.PRM.PRSL.ZS,"Persistence to last grade of primary, total (% of cohort)",,,,,,,,,,,,,,,,,,,,,,
SSD,South Sudan,SE.PRM.TENR,"Total enrollment, primary (% net)",,,,,,,,,,,,,,,,,,,,,,
SSD,South Sudan,SG.GEN.PARL.ZS,Proportion of seats held by women in national parliaments (%),,,,,,,,,,,,,,,,,,,,,,
SSD,South Sudan,SH.CON.1524.FE.ZS,"Condom use, population ages 15-24, female (% of females ages 15-24)",,,,,,,,,,,,,,,,,,,,,,
SSD,South Sudan,SH.CON.1524.MA.ZS,"Condom use, population ages 15-24, male (% of males ages 15-24)",,,,,,,,,,,,,,,,,,,,,,
SSD,South Sudan,SH.CON.AIDS.FE.ZS,"Condom use with non regular partner, % adults(15-49), female",,,,,,,,,,,,,,,,,,,,,,
SSD,South Sudan,SH.CON.AIDS.MA.ZS,"Condom use with non regular partner, % adults(15-49), male",,,,,,,,,,,,,,,,,,,,,,
SSD,South Sudan,SH.DYN.AIDS.DH,AIDS estimated deaths (UNAIDS estimates),,,,,,,,,,,,,,,,,,,,,,
SSD,South Sudan,SH.DYN.AIDS.ZS,"Prevalence of HIV, total (% of population ages 15-49)",,,,,,,,,,,,,,,,,,,,,,
SSD,South Sudan,SH.DYN.MORT,"Mortality rate, under-5 (per 1,000)",,,,,,,,,,,,,,,,,,,,,,
SSD,South Sudan,SH.H2O.SAFE.ZS,Improved water source (% of population with access),,,,,,,,,,,,,,,,,,,,,,
SSD,South Sudan,SH.HIV.1524.FE.ZS,"Prevalence of HIV, female (% ages 15-24)",,,,,,,,,,,,,,,,,,,,,,
SSD,South Sudan,SH.HIV.1524.KW.FE.ZS,"Comprehensive correct knowledge of HIV/AIDS, ages 15-24, female (2 prevent ways and reject 3 misconceptions)",,,,,,,,,,,,,,,,,,,,,,
SSD,South Sudan,SH.HIV.1524.KW.MA.ZS,"Comprehensive correct knowledge of HIV/AIDS, ages 15-24, male (2 prevent ways and reject 3 misconceptions)",,,,,,,,,,,,,,,,,,,,,,
SSD,South Sudan,SH.HIV.1524.MA.ZS,"Prevalence of HIV, male (% ages 15-24)",,,,,,,,,,,,,,,,,,,,,,
SSD,South Sudan,SH.HIV.ARTC.ZS,Antiretroviral therapy coverage (% of people with advanced HIV infection),,,,,,,,,,,,,,,,,,,,,,
SSD,South Sudan,SH.HIV.KNOW.FE.ZS,Percentage of females ages 15-49 having comprehensive correct knowledge about HIV (2 prevent ways and reject 3 misconceptions) (%),,,,,,,,,,,,,,,,,,,,,,
SSD,South Sudan,SH.HIV.KNOW.MA.ZS,Percentage of males ages 15-49 having comprehensive correct knowledge about HIV (2 prevent ways and reject 3 misconceptions) (%),,,,,,,,,,,,,,,,,,,,,,
SSD,South Sudan,SH.HIV.ORPH,Children orphaned by HIV/AIDS,,,,,,,,,,,,,,,,,,,,,,
SSD,South Sudan,SH.IMM.MEAS,"Immunization, measles (% of children ages 12-23 months)",,,,,,,,,,,,,,,,,,,,,,
SSD,South Sudan,SH.MLR.NETS.ZS,Use of insecticide-treated bed nets (% of under-5 population),,,,,,,,,,,,,,,,,,,,,,
SSD,South Sudan,SH.MLR.TRET.ZS,Children with fever receiving antimalarial drugs (% of children under age 5 with fever),,,,,,,,,,,,,,,,,,,,,,
SSD,South Sudan,SH.STA.ACSN,Improved sanitation facilities (% of population with access),,,,,,,,,,,,,,,,,,,,,,
SSD,South Sudan,SH.STA.ANV4.ZS,Pregnant women receiving prenatal care of at least four visits (% of pregnant women),,,,,,,,,,,,,,,,,,,,,,
SSD,South Sudan,SH.STA.ANVC.ZS,Pregnant women receiving prenatal care (%),,,,,,,,,,,,,,,,,,,,,,
SSD,South Sudan,SH.STA.ARIC.ZS,ARI treatment (% of children under 5 taken to a health provider),,,,,,,,,,,,,,,,,,,,,,
SSD,South Sudan,SH.STA.BRTC.ZS,Births attended by skilled health staff (% of total),,,,,,,,,,,,,,,,,,,,,,
SSD,South Sudan,SH.STA.MALN.ZS,"Malnutrition prevalence, weight for age (% of children under 5)",,,,,,,,,,,,,,,,,,,,,,
SSD,South Sudan,SH.STA.MALR,Malaria cases reported,,,,,,,,,,,,,,,,,,,,,,
SSD,South Sudan,SH.STA.MMRT,"Maternal mortality ratio (modeled estimate, per 100,000 live births)",,,,,,,,,,,,,,,,,,,,,,
SSD,South Sudan,SH.TBS.CURE.ZS,Tuberculosis treatment success rate (% of registered cases),,,,,,,,,,,,,,,,,,,,,,
SSD,South Sudan,SH.TBS.DTEC.ZS,"Tuberculosis case detection rate (%, all forms)",,,,,,,,,,,,,,,,,,,,,,
SSD,South Sudan,SH.TBS.INCD,"Incidence of tuberculosis (per 100,000 people)",,,,,,,,,,,,,,,,,,,,,,
SSD,South Sudan,SH.TBS.MORT,"Tuberculosis death rate (per 100,000 people)",,,,,,,,,,,,,,,,,,,,,,
SSD,South Sudan,SI.DST.FRST.20,Income share held by lowest 20%,,,,,,,,,,,,,,,,,,,,,,
SSD,South Sudan,SI.POV.2DAY,Poverty headcount ratio at $2 a day (PPP) (% of population),,,,,,,,,,,,,,,,,,,,,,
SSD,South Sudan,SI.POV.DDAY,Poverty headcount ratio at $1.25 a day (PPP) (% of population),,,,,,,,,,,,,,,,,,,,,,
SSD,South Sudan,SI.POV.GAP2,Poverty gap at $2 a day (PPP) (%),,,,,,,,,,,,,,,,,,,,,,
SSD,South Sudan,SI.POV.GAPS,Poverty gap at $1.25 a day (PPP) (%),,,,,,,,,,,,,,,,,,,,,,
SSD,South Sudan,SI.POV.NAGP,Poverty gap at national poverty line (%),,,,,,,,,,,,,,,,,,,,,,
SSD,South Sudan,SI.POV.NAHC,Poverty headcount ratio at national poverty line (% of population),,,,,,,,,,,,,,,,,,,,,,
SSD,South Sudan,SI.POV.RUGP,Poverty gap at rural poverty line (%),,,,,,,,,,,,,,,,,,,,,,
SSD,South Sudan,SI.POV.RUHC,Poverty headcount ratio at rural poverty line (% of rural population),,,,,,,,,,,,,,,,,,,,,,
SSD,South Sudan,SI.POV.URGP,Poverty gap at urban poverty line (%),,,,,,,,,,,,,,,,,,,,,,
SSD,South Sudan,SI.POV.URHC,Poverty headcount ratio at urban poverty line (% of urban population),,,,,,,,,,,,,,,,,,,,,,
SSD,South Sudan,SL.EMP.1524.SP.FE.ZS,"Employment to population ratio, ages 15-24, female (%)",,,,,,,,,,,,,,,,,,,,,,
SSD,South Sudan,SL.EMP.1524.SP.MA.ZS,"Employment to population ratio, ages 15-24, male (%)",,,,,,,,,,,,,,,,,,,,,,
SSD,South Sudan,SL.EMP.1524.SP.ZS,"Employment to population ratio, ages 15-24, total (%)",,,,,,,,,,,,,,,,,,,,,,
SSD,South Sudan,SL.EMP.INSV.FE.ZS,Share of women employed in the nonagricultural sector (% of total nonagricultural employment),,,,,,,,,,,,,,,,,,,,,,
SSD,South Sudan,SL.EMP.SELF.FE.ZS,"Self-employed, female (% of females employed)",,,,,,,,,,,,,,,,,,,,,,
SSD,South Sudan,SL.EMP.SELF.MA.ZS,"Self-employed, male (% of males employed)",,,,,,,,,,,,,,,,,,,,,,
SSD,South Sudan,SL.EMP.SELF.ZS,"Self-employed, total (% of total employed)",,,,,,,,,,,,,,,,,,,,,,
SSD,South Sudan,SL.EMP.TOTL.SP.FE.ZS,"Employment to population ratio, 15+, female (%)",,,,,,,,,,,,,,,,,,,,,,
SSD,South Sudan,SL.EMP.TOTL.SP.MA.ZS,"Employment to population ratio, 15+, male (%)",,,,,,,,,,,,,,,,,,,,,,
SSD,South Sudan,SL.EMP.TOTL.SP.ZS,"Employment to population ratio, 15+, total (%)",,,,,,,,,,,,,,,,,,,,,,
SSD,South Sudan,SL.EMP.VULN.FE.ZS,"Vulnerable employment, female (% of female employment)",,,,,,,,,,,,,,,,,,,,,,
SSD,South Sudan,SL.EMP.VULN.MA.ZS,"Vulnerable employment, male (% of male employment)",,,,,,,,,,,,,,,,,,,,,,
SSD,South Sudan,SL.EMP.VULN.ZS,"Vulnerable employment, total (% of total employment)",,,,,,,,,,,,,,,,,,,,,,
SSD,South Sudan,SL.FAM.WORK.FE.ZS,"Contributing family workers, female (% of females employed)",,,,,,,,,,,,,,,,,,,,,,
SSD,South Sudan,SL.FAM.WORK.MA.ZS,"Contributing family workers, male (% of males employed)",,,,,,,,,,,,,,,,,,,,,,
SSD,South Sudan,SL.FAM.WORK.ZS,"Contributing family workers, total (% of total employed)",,,,,,,,,,,,,,,,,,,,,,
SSD,South Sudan,SL.GDP.PCAP.EM.KD,GDP per person employed (constant 1990 PPP $),,,,,,,,,,,,,,,,,,,,,,
SSD,South Sudan,SN.ITK.DEFC.ZS,Prevalence of undernourishment (% of population),,,,,,,,,,,,,,,,,,,,,,
SSD,South Sudan,SP.ADO.TFRT,"Adolescent fertility rate (births per 1,000 women ages 15-19)",,,,,,,,,,,,,,,,,,,,,,
SSD,South Sudan,SP.DYN.CONU.ZS,Contraceptive prevalence (% of women ages 15-49),,,,,,,,,,,,,,,,,,,,,,
SSD,South Sudan,SP.DYN.IMRT.IN,"Mortality rate, infant (per 1,000 live births)",,,,,,,,,,,,,,,,,,,,,,
SSD,South Sudan,SP.DYN.LE00.IN,"Life expectancy at birth, total (years)",,,,,,,,,,,,,,,,,,,6.15121951220000E+01,,,
SSD,South Sudan,SP.DYN.TFRT.IN,"Fertility rate, total (births per woman)",,,,,,,,,,,,,,,,,,,3.85000000000000E+00,,,
SSD,South Sudan,SP.POP.TOTL,"Population, total",,,,,,,,,,,,,,,,,,,,,8.07900000000000E+06,
SSD,South Sudan,SP.UWT.TFRT,Unmet need for contraception (% of married women ages 15-49),,,,,,,,,,,,,,,,,,,,,,
SSD,South Sudan,TM.MRC.NOTX.DV.ZS,Goods (excluding arms) admitted free of tariffs from developing countries (% total merchandise imports excluding arms),,,,,,,,,,,,,,,,,,,,,,
SSD,South Sudan,TM.MRC.NOTX.LD.ZS,Goods (excluding arms) admitted free of tariffs from least developed countries (% total merchandise imports excluding arms),,,,,,,,,,,,,,,,,,,,,,
SSD,South Sudan,TM.TAX.AGRI.CD.DV,Average tariffs imposed by developed countries on agricultural products from developing countries (%),,,,,,,,,,,,,,,,,,,,,,
SSD,South Sudan,TM.TAX.AGRI.CD.LD,Average tariffs imposed by developed countries on agricultural products from least developed countries (%),,,,,,,,,,,,,,,,,,,,,,
SSD,South Sudan,TM.TAX.CLTH.CD.DV,Average tariffs imposed by developed countries on clothing products from developing countries (%),,,,,,,,,,,,,,,,,,,,,,
SSD,South Sudan,TM.TAX.CLTH.CD.LD,Average tariffs imposed by developed countries on clothing products from least developed countries (%),,,,,,,,,,,,,,,,,,,,,,
SSD,South Sudan,TM.TAX.TXTL.CD.DV,Average tariffs imposed by developed countries on textile products from developing countries (%),,,,,,,,,,,,,,,,,,,,,,
SSD,South Sudan,TM.TAX.TXTL.CD.LD,Average tariffs imposed by developed countries on textile products from least developed countries (%),,,,,,,,,,,,,,,,,,,,,,
